{
  "schema_version": "1.0.0",
  "record_class": "CONSPICUOUSLY_SYNTHETIC_B1_CONTENT_EMBARGO_METADATA",
  "synthetic_candidate_id": "SYNTH-B1-CANDIDATE-VOID0001",
  "source_route_status": "UNSELECTED",
  "provenance_digest": "sha256:aaaaaaaaaaaaaaaaaaaaaaaaaaaaaaaaaaaaaaaaaaaaaaaaaaaaaaaaaaaaaaaa",
  "session_digest": "sha256:bbbbbbbbbbbbbbbbbbbbbbbbbbbbbbbbbbbbbbbbbbbbbbbbbbbbbbbbbbbbbbbb",
  "access_ledger_digest": "sha256:cccccccccccccccccccccccccccccccccccccccccccccccccccccccccccccccc",
  "synthetic_actor_id": "SYNTH-B1-ACTOR-META0001",
  "role_id": "ASTROHD_AWARE_GOVERNANCE",
  "astrohd_exposure_state": "PROCESS_METADATA_ONLY",
  "contamination_state": "CLEAN_SYNTHETIC_METADATA_ONLY",
  "version_id": "SYNTH-B1-VERSION-VOID0001",
  "supersession_status": "NONE",
  "specific_scan_status": "NOT_STARTED",
  "freeze_status": "METADATA_GATE_CLOSED",
  "unresolved_decision_ids": ["UNRESOLVED-B1-01", "UNRESOLVED-B1-02"],
  "content_embargo_status": "ACTIVE_NO_CONTENT"
}
